{
  "schema": "dgbook.lesson-ast/v1",
  "source": {
    "kind": "docx",
    "path": "content/5g/5g.docx",
    "importer": "scripts/import-5g-docx.py"
  },
  "project": {
    "id": "P09",
    "title": "5G网络参数检查",
    "sourceNo": "3",
    "chapterTitle": "5G网络信息管理",
    "taskIndex": 3
  },
  "lesson": {
    "id": "P09",
    "title": "5G网络参数检查",
    "widgetId": "P09-lesson-animation-001",
    "scenario": "parameter",
    "scenarioLabel": "参数优化"
  },
  "content": {
    "sections": [
      {
        "id": "sec-overview",
        "title": "导学摘要",
        "icon": "overview",
        "texts": [
          "本节讲参数核查：先锁定网元、小区、邻区、切片和 QoS 等对象范围，再把现网快照与规划基线转成风险治理清单。"
        ]
      },
      {
        "id": "P09-ku-01",
        "title": "概念与对象",
        "icon": "radar",
        "texts": [
          "参数核查先定义对象范围：网元、小区、邻区、切片、QoS 或策略对象不同，影响域和回退范围也不同。"
        ]
      },
      {
        "id": "P09-ku-02",
        "title": "概念与对象",
        "icon": "route",
        "texts": [
          "现网值需要保存导出时间、网管版本、对象范围和数据来源，避免把过期或局部数据当作全量事实。"
        ]
      },
      {
        "id": "P09-ku-03",
        "title": "工程判读",
        "icon": "chart",
        "texts": [
          "规划基线不是孤立表格，要结合覆盖场景、频段层、邻区关系、容量目标和业务策略确定期望取值。"
        ]
      },
      {
        "id": "P09-ku-04",
        "title": "数据与现场佐证",
        "icon": "tool",
        "texts": [
          "参数差异先进入风险树：覆盖类看功率和倾角，切换类看邻区与门限，容量类看负荷策略，业务类看 QoS 与切片策略。"
        ]
      },
      {
        "id": "P09-ku-05",
        "title": "操作校验",
        "icon": "search",
        "texts": [
          "不是所有差异都立即修改，处置准入要同时满足风险等级、影响范围、回退条件、变更窗口和监控观察要求。"
        ]
      },
      {
        "id": "P09-ku-06",
        "title": "闭环复盘",
        "icon": "check",
        "texts": [
          "参数核查最终形成治理清单，包含差异类型、影响域、风险等级、建议动作、审批状态和回退条件。"
        ]
      }
    ],
    "blocks": [
      {
        "id": "block-001",
        "kind": "paragraph",
        "order": 1,
        "text": "任务导入"
      },
      {
        "id": "block-002",
        "kind": "paragraph",
        "order": 2,
        "text": "在网络规划过程中，需要考虑哪些因素？如果网络性能指标出现下降，比如说，掉话率升高了，除了检查基站设备告警信息和天馈系统工作状态还有哪些方面需要检查？对于掉话问题，无线网络参数检查大家能想到哪些呢？传输网和核心网需要配合检查哪些参数？"
      },
      {
        "id": "block-003",
        "kind": "paragraph",
        "order": 3,
        "text": "任务要求"
      },
      {
        "id": "block-004",
        "kind": "paragraph",
        "order": 4,
        "text": "掌握5G网络规划计算。"
      },
      {
        "id": "block-005",
        "kind": "paragraph",
        "order": 5,
        "text": "完成5G网优相关的无线参数检查操作。"
      },
      {
        "id": "block-006",
        "kind": "paragraph",
        "order": 6,
        "text": "完成5G网优相关的传输网络参数检查操作。"
      },
      {
        "id": "block-007",
        "kind": "paragraph",
        "order": 7,
        "text": "完成5G网优相关的核心网络参数检查操作。"
      },
      {
        "id": "block-008",
        "kind": "paragraph",
        "order": 8,
        "text": "了解无线网络参数导入/导出功能，以及参数比较。"
      },
      {
        "id": "block-009",
        "kind": "paragraph",
        "order": 9,
        "text": "知识准备"
      },
      {
        "id": "block-010",
        "kind": "paragraph",
        "order": 10,
        "text": "一． 5G无线网管配置管理概述"
      },
      {
        "id": "block-011",
        "kind": "paragraph",
        "order": 11,
        "mediaRefs": [
          "rId153"
        ]
      },
      {
        "id": "block-012",
        "kind": "paragraph",
        "order": 12,
        "text": "图3-3-1 无线网管配置"
      },
      {
        "id": "block-013",
        "kind": "paragraph",
        "order": 13,
        "text": "网管提供多种场景下的配置数据检查功能，帮助排除参数类故障。主要包括数据比较和网元变更查看两个子功能。 数据比较，提供现网区数据与网元实际数据、两个网元的现网区数据的对比。 网元变更查看，查询指定时间段内网元数据变化情况。"
      },
      {
        "id": "block-014",
        "kind": "paragraph",
        "order": 14,
        "text": "运维人员可以通过对现网区保存的网元数据与网元实际数据、两个网元在现网区保存的数据的比较结果确认数据的正确性。"
      },
      {
        "id": "block-015",
        "kind": "paragraph",
        "order": 15,
        "text": "（一）5G无线网管参数查询窗口介绍，如图3-3-2"
      },
      {
        "id": "block-016",
        "kind": "paragraph",
        "order": 16,
        "mediaRefs": [
          "rId154"
        ]
      },
      {
        "id": "block-017",
        "kind": "paragraph",
        "order": 17,
        "text": "图3-3-2 5G无线网管参数查询窗口"
      },
      {
        "id": "block-018",
        "kind": "paragraph",
        "order": 18,
        "text": "（二）配置数据导入"
      },
      {
        "id": "block-019",
        "kind": "paragraph",
        "order": 19,
        "text": "通过数据批量导入配置参数。如下图3-3-3"
      },
      {
        "id": "block-020",
        "kind": "paragraph",
        "order": 20,
        "text": "登录5G网管后，从左侧导航栏选取“配置参数管理”，然后在右侧界面点击导入，将本地excel格式配置文件批量导入网管。"
      },
      {
        "id": "block-021",
        "kind": "paragraph",
        "order": 21,
        "mediaRefs": [
          "rId155"
        ]
      },
      {
        "id": "block-022",
        "kind": "paragraph",
        "order": 22,
        "text": "图3-3-3 配置数据模板"
      },
      {
        "id": "block-023",
        "kind": "paragraph",
        "order": 23,
        "text": "配置数据导出"
      },
      {
        "id": "block-024",
        "kind": "paragraph",
        "order": 24,
        "text": "通过数据导出功能可以将站点配置参数导出后离线检查参数设置。如下图3-3-4"
      },
      {
        "id": "block-025",
        "kind": "paragraph",
        "order": 25,
        "text": "以学生账号登录5G网管后，从左侧导航栏选取“配置”，选取“站点”，“小区参数”，然后在右侧界面点击“全部数据导出”，将该小区所有配置数据以excel格式导出到网管。"
      },
      {
        "id": "block-026",
        "kind": "paragraph",
        "order": 26,
        "mediaRefs": [
          "rId156"
        ]
      },
      {
        "id": "block-027",
        "kind": "paragraph",
        "order": 27,
        "text": "图3-3-4 配置数据导出窗口"
      },
      {
        "id": "block-028",
        "kind": "paragraph",
        "order": 28,
        "text": "二．5G网络规划参数"
      },
      {
        "id": "block-029",
        "kind": "paragraph",
        "order": 29,
        "text": "（一）容量计算"
      },
      {
        "id": "block-030",
        "kind": "paragraph",
        "order": 30,
        "text": "（1）不同帧结构下的上下行资源占比"
      },
      {
        "id": "block-031",
        "kind": "paragraph",
        "order": 31,
        "text": "2.5ms双周期时隙配比： DDDSU DDSUU 特殊S配比：D:Gap:U=10:2:2"
      },
      {
        "id": "block-032",
        "kind": "paragraph",
        "order": 32,
        "text": "5ms单周期时隙配比： DDDDD DDSUU 特殊S配比：D:Gap:U=6:4:4"
      },
      {
        "id": "block-033",
        "kind": "paragraph",
        "order": 33,
        "text": "上行资源占比（符号级)=(帧周期内特殊时隙个数*特殊时隙内上行符号个数+帧周期内上行时隙个数*14)/(14*10)"
      },
      {
        "id": "block-034",
        "kind": "paragraph",
        "order": 34,
        "text": "下行资源占比（符号级)=(帧周期内特殊时隙个数*特殊时隙内下行符号个数+帧周期内下行时隙个数*14)/(14*10)"
      },
      {
        "id": "block-035",
        "kind": "paragraph",
        "order": 35,
        "text": "（2）上下行等效TBS的计算"
      },
      {
        "id": "block-036",
        "kind": "paragraph",
        "order": 36,
        "text": "上行等效TBS=上行速率/上行资源占比/2"
      },
      {
        "id": "block-037",
        "kind": "paragraph",
        "order": 37,
        "text": "下行等效TBS=下行速率/下行资源占比/2"
      },
      {
        "id": "block-038",
        "kind": "paragraph",
        "order": 38,
        "text": "（3）基于容量的基站规划"
      },
      {
        "id": "block-039",
        "kind": "paragraph",
        "order": 39,
        "text": "根据业务模型计算区域上行、下行总吞吐量"
      },
      {
        "id": "block-040",
        "kind": "paragraph",
        "order": 40,
        "text": "区域总下行吞吐量=区域总移动用户数*运营商市场比例*5G终端渗透率*区域用户平均下行吞吐量"
      },
      {
        "id": "block-041",
        "kind": "paragraph",
        "order": 41,
        "text": "区域总上行吞吐量=区域总移动用户数*运营商市场比例*5G终端渗透率*区域用户平均上行吞吐量"
      },
      {
        "id": "block-042",
        "kind": "paragraph",
        "order": 42,
        "text": "计算单扇区最大吞吐量"
      },
      {
        "id": "block-043",
        "kind": "paragraph",
        "order": 43,
        "text": "单扇区小区下行最大吞吐量=［载波聚合等级*MIMO的层数(流数）*调制方式对应的比特数*RB数量*每RB子载波数*编码效率*比例因子*（1-控制信令开销）］/下行符号时长"
      },
      {
        "id": "block-044",
        "kind": "paragraph",
        "order": 44,
        "text": "单扇区小区上行最大吞吐量=［载波聚合等级*MIMO的层数(流数）*调制方式对应的比特数*RB数量*每RB子载波数*编码效率*比例因子*（1-控制信令开销）］/上行符号时长"
      },
      {
        "id": "block-045",
        "kind": "paragraph",
        "order": 45,
        "text": "计算所需基站数量"
      },
      {
        "id": "block-046",
        "kind": "paragraph",
        "order": 46,
        "text": "下行需要基站数量=区域总下行吞吐量/单扇区小区下行最大吞吐量/3"
      },
      {
        "id": "block-047",
        "kind": "paragraph",
        "order": 47,
        "text": "上行需要基站数量=区域总上行吞吐量/单扇区小区上行最大吞吐量/3"
      },
      {
        "id": "block-048",
        "kind": "paragraph",
        "order": 48,
        "text": "（二）覆盖计算"
      },
      {
        "id": "block-049",
        "kind": "paragraph",
        "order": 49,
        "text": "（1） 下行单天线发射功率（单位：W）"
      },
      {
        "id": "block-050",
        "kind": "paragraph",
        "order": 50,
        "text": "上行单天线发射功率（单位：W）"
      },
      {
        "id": "block-051",
        "kind": "paragraph",
        "order": 51,
        "text": "将dBm换成W: W=power(10,dBm/10)"
      },
      {
        "id": "block-052",
        "kind": "paragraph",
        "order": 52,
        "text": "（2）计算总发射功率"
      },
      {
        "id": "block-053",
        "kind": "paragraph",
        "order": 53,
        "text": "下行总发射功率=单天线发射功率*发射天线数量"
      },
      {
        "id": "block-054",
        "kind": "paragraph",
        "order": 54,
        "text": "上行发射总功率=单天线发射功率*发射天线数量"
      },
      {
        "id": "block-055",
        "kind": "paragraph",
        "order": 55,
        "text": "（3）发射天线增益：基站侧8T为16.5dBi，16T为15dBi，32T为13dBi，64T为11dBi，终端侧为0dBi"
      },
      {
        "id": "block-056",
        "kind": "paragraph",
        "order": 56,
        "text": "（4）发射天线阵列增益=10*log(发射天线数量)dB"
      },
      {
        "id": "block-057",
        "kind": "paragraph",
        "order": 57,
        "text": "下行发射天线阵列增益"
      },
      {
        "id": "block-058",